"Whether he behaves in that manner or not, it's fear and it's a risk.
This is making investors nervous that the tax cuts may not happen at all.
the Great Depression who couldn't pay their mortgages and lost
But critics said the discussions were not widely known.
Personal attacks, especially on other participants, are not permitted.
The seasonality can be a problem, however, if you're not aware of it.
Airbus says risks remain, so the bleeding may not stop here.
Plagued with problems, the Horten didn't last long in combat.
He did not identify the hombres or why they are bad.
The company isn't alone in struggling to attract more customers.
"Peoria is not unique in that tragedy across the country.
But that didn't fix the problem.
widespread complaints among shoppers that they can't find an
In short, it's not cheap to attend the Super Bowl.
The company can't take on any more debt.
The deal, however, is not without its risks.
Dollar General has not been immune to the difficult climate facing retailers.
"Magellan has not yet determined the cause of the pipeline rupture."
U. S. Steel is not the only mining company operating with an expired permit.
"The rise in U. S. output should not be unexpected," ANZ bank said
They don't realize how much damage their company rules do.
Savings are not only unassured, they are doubtful.
People don't do that when they're worried about their future.
For one, they may not share your vision; some may actually oppose it.
It’s not just the Nasdaq that’s suffering from narrow breadth.
You’ll be fined $25 per violation, plus the toll that was not paid.
Is it because companies don't have faith in the recovery?
"And we are not the only ones that need clarity."
He might not be as lucky with the pension reform Wall Street is betting on.
"We can't afford to keep going the way we're going," Zimmerman says.
Interest rate modifications have not worked for the ECB.
I’ve always said that the policy (60 per cent allocation) was not sustainable.
Structures can't be built over top of them.
These small dogs still won't fly.
But "Donald Trump is not the cure-all for the coal industry," he says.
They always tell me what a great job I'm doing but the money doesn't follow.
The referendum would not fund fancy high schools, she said.
"OPEC won't publish production levels until the middle of next month.
As non-citizens, they can't benefit from the government safety net.
If the plan isn't working, come up with a better plan next time.
Details of their bonuses are not yet available.
If they are lower, then you don't benefit.
Another has a connection that isn't smooth.
"That is, he won't tolerate them, regardless of the business opportunity.
I won't touch them.
They are not worth the energy.
Other largescale Southern unionization efforts haven't met recent success.
“I’m not sure these infrastructure improvements are needed.
It was not clear if local government firms were excluded from the new rules.
The answer did not satisfy everyone.
Admittedly, there’s not been much progress in that direction in recent years.
But the gains have not been all that strong.
Traders didn't take the news well.
Currently enrolled CCS students and faculty are not eligible for the award.
“The history is not good.
He wasn't confident that the stock can rally 13 percent to its recent high.
They're not going to serve the interests of Goldman Sachs.
"They declined because they thought we wouldn't be successful."
These numbers were not as strong as I would like to see.
It’s not something the Town of Brookhaven would be receptive to.
But steady is not enough and there remains considerable room for improvement.
"There's not enough income to allow people to get into housing," he said.
It isn't clear which markets would receive the phones.
And the outlook for the new year is not much better.
Of course, you may not have the luxury of weighing multiple options.
Others won't be eligible for the aid.
You can't buy at the very bottom and you can't sell at the very top.
There is not a single guarantee Ford will be in the vanguard of this work.
Certainly not enough to occupy all the Mexicans looking for work.
These were not recommendations.
"But that is seasonal and not enough for the all the village cattle," he said.
You're not done until the underwriters have cleared you for your closing.
The bank won't say how it moves the gold.
"Fundamentally, they're not generating enough income from what
This is not the federal graduation rate and our report makes that clear.
Each of those by itself won't be enough to derail the long-term trend.
quarters, but we think closing the gates is not feasible over the
"We do not have enough in the digital media yet.
"It was not perhaps the most optimistic presidential speech I've heard.
Unfortunately, The Gap's performance did not improve much in 2016.
The amount of the extra benefit due to proration is not easily quantifiable.
Looking abroad, the theme is the same - not too much to get excited about.
“To date, to my knowledge, the IRS has not provided any guidance.
But globally, the Paris climate deal is not nearly enough.
not the best person to improve higher education.
I’m not sure there’s an easy answer to that question.
system where we've not established clarity between the sales side
However, he wasn't confident that it can close the gap between $53 and $67.
But the group did not recommend eliminating it.
But Donald Trump wasn't expected to win either.
All is not so great in venture capital either.
They’re not going to serve the interests of Goldman Sachs.
West Wales authorities do not feature in the top ten.
But they did not all go smoothly.
Yet behind the handshaking and photo ops, the indicators were not so positive.
"[I'm] not sure if the optimism is justified," Baily said.
He’s not looking to improve the nation’s biofuels program.
Whalen considers the Fed's long-term rate expectations to be "not credible."
The requisite capital and public support are simply not there.
Those promotions didn't work out the best.
"They don't have enough votes to approve projects."
He’s not happy.“It has nothing to do with what he likes — the outdoors stuff.
Acquiring the property was not realistic, given its price, she said.
But the backing of Buffett hasn't been enough to turnaround Sears either.
Foreigners may not love us
Other shareholders were not as lucky as Ross and his firm.
I won't give you the particular name
And the new was not good.
These were not recommendations.
But not everyone is thrilled with their slice of the pie.
"It shows there isn't a sense of euphoria," Hoskin said.
The size of Chevy’s social media spend, however, is not clear.
Putting together Wildcat Weekly isn't all fun and games, however.
The cost of reinforcing the hillside was not immediately clear.
have not acted in their best interest.
Other auto industry analysts aren't as bullish.
"They don't do a particularly good job
"In other places, perhaps, they won't be quite as successful.
The A380 jumbo jet program certainly isn't doing well.
"Because the economics just don't work.
