EOG has been paring its income losses steadily for the past four quarters, and appears to be ready to profit as the oil glut ends in 2017.
The company has been reducing its income losses in recent quarters, and this deal is likely to provide the income boost the company needs.
If the International Energy Agency is correct, oil prices could rise sharply at the end of 2017.
One issue also worth noting was that the loan growth weaker than expected.
If you aren't used to boom and bust in Florida, you might soon get another lesson.
"My concern would be, 'When will the bloom fall off the rose?'
If true, this means that the company’s actions may be leading to excessive interest charges and unnecessary defaults," he added.
But his ability to help the U. S. economy might depend on whether Trump can strike better deals on his own.
Mastering arcane details about labor standards and domestic goods could determine whether Trump can deliver on his promise.
Those negotiations could be tricky for U. S. workers because Trump's victory has led to a decline in the Mexican peso.
But the North Side recovery remains incomplete until economic recovery delivers more opportunity and wealth for residents.
The other major issue with the Dreamliner is improving the product line's profitability.
AP — Uber Technologies is paying $20 million to settle allegations that it duped people into driving for them with false promises.
When Mayer joined the company in 2012, she was seen as a potential savior for the troubled internet pioneer.
+65 6212 1000Untethering the ruble helped Russia ride out the biggest oil downturn in a generation.
The school, work and life hacks you need to get ahead.
It had its best-ever year in 2016, when it appreciated 20 percent, after losing half its value against the dollar in 2014-2015.
They operate in a restaurant segment being hit hard by changing consumer tastes and the rise of fast-casual chains such as Panera Bread.
Tariffs "might hurt Mexico more, but it would hurt the United States as well," Bown said.
These funds have already been bloated by money market reform, which resulted in assets increasing by approximately $1 trillion in 2016.
The “risk-free” rate can be considered the return on an investment that, in theory, carries no risk.
"Although our sales and earnings fell short of our expectations, I believe we made progress on our initiatives in the quarter.
"While conditions remain difficult, Vasos believes that well-planned growth should help strengthen the company.
He touted Pennsylvania as leading candidate for the plant, but said Foxconn is in discussions with other states, too.
Government grant money covered the cost of the eCenter and the training center, leaving the city as landlord of debt-free buildings.
We want to use the building to support businesses in the region.”The eCenter got off to a slow start when it opened in 2012.
)“He intends to do the work on the issues he discussed on the campaign trail,” McGarvey said.
"Trump made the debate over free trade one of the central topics of his campaign after criticizing China, Mexico, and Japan.
"Protectionism has become more popular as American workers worry about losing jobs to other countries.
And regardless of the terrible, rotten, disgraceful year that 2016 was, somebody has to win something.
With its technology, power, and performance, the Challenger leads the pack with 10 available bad-to-the bone trim levels.
This was Samsung fulfilling its promise to explain exactly what went wrong with the phone.
Thus the disastrous second recall, at which time Samsung pulled the product from markets worldwide for good.
We've speculated it and you have, too: couldn't Samsung have avoided some of its pain by giving the Note 7 a replaceable battery?
That is a pretty grim fate for the group," the "Mad Money" host said.
Storms in Northern California were quickly easing the drought.
He said: “There [are] people who work in the mining industry and associated infrastructure who aren’t bad people.
Shale gas magical thinking remains strong but the paradigm of infinite, cheap supply is no longer working.
The exuberant days of cheap, abundant natural gas are over.
The school, work and life hacks you need to get ahead.
The trend has yet to put a damper on optimism at Ford’s chief rival.
That modest paring of losses stalled but picked up again heading into the close.
which can benefits from weakness in the buck, settled up 0.9% at $1,215.60 an ounce.
And Brazil, Miami’s top international market, suffered the most: 600,000 fewer passengers traveled between MIA and Brazil in 2016.
In August, weeks after the first Zika announcement, MIA saw passenger traffic flip from anemic growth to a modest decline.
The decline of high-paying factory jobs contributed to Trump's victory in Rust Belt states such as Pennsylvania, Ohio and Michigan.
Overly bullish sentiment on crude oil is easing up, but the price has stayed more or less the same.
Therefore, if the floor falls out of the used car and truck market, Ford is going to find it incredibly difficult to move stock in 2017.
Interest Rates to Rise MeaningfullyThe U. S. long bond has been unable to recover its 50-day moving average.
If they break these, we are going to see significant interest rate hikes this year.
Get the latest news on recent and upcoming IPOs, filings for new issues, and today’s top-performing IPO stocks.
Get 4 free weeks of the IBD Digital edition plus access to IBD's exclusive market analysis, proprietary stock ratings and interactive tools.
Minnich said chances look good that the storm track will return.“Sometime in February or March, we’re going to get bashed again,” he said.
Easterbrook said the issue of customer counts in the U. S. "dominates our conversations as we plan our business."
"Easterbrook said the issue of customer counts in the U. S. "dominates our conversations as we plan our business."
The stock has now reversed at that formidable barrier five times, including the early January 2017 failure.
The U. S. currency rallies sharply after the election, but has given back some gains.
She has promised to initiate the Article 50 in March and deliver it in two years and Supreme court's decision has made that difficult.
Navient denied the CFPB’s allegations in a statement Wednesday, saying they are false and politically motivated.
The so-called student debt relief companies often advertise messages such as “Obama Student Loan Forgiveness” on Facebook and Google.
And today I'm ready to come out of the closet and share my money mistakes and regrets.
We were comfortable with a "bare-bones" emergency fund and living the frugal life which allowed us to maximize investments.
We Were Careful with Debt – This may be the most important one, but we were cautious with debt.
And nowadays there are great tools available to easily analyze the ability to tax loss harvest including with the brokerage firm Betterment.
Progressives will argue that significant human needs are being neglected, and they will be able to point to numerous supportive anecdotes.
As I alluded at the beginning of this article, that is not a totally fair criticism of the professor's column.
The next factors she considered were: Was who owns oil right now, and is it in weak or strong hands.
The last time big traders and investors were this bullish on crude, the price of oil crashed 60 percent over the following six months.
On the flipside, she found a floor of support at $46 and if it breaks below that level, crude could plunge to $40.
As the Spyder Trust (SPY) has been moving sideways and the iShares Russell 2000 (IWM) has been declining some ETFs have had nice gains.
There is over 61% in the top ten with over 23% in D. R. Horton (DHI) and Lennar Corp (LEN ) that were both sharply higher on the day.
This typically means there will be a better risk entry in the next week.
The moves on the pipelines had been widely expected, as Trump last year blasted his predecessor for effectively blocking the projects.
He also ordered federal agencies on his first day in office to ease the regulatory burden of the Affordable Care Act.
Storms in Northern California were quickly easing the drought.
The redevelopers aim to start construction this fall and be ready for occupancy in the late third quarter of 2018.
The angry opposition to the announcements comes mostly from places and groups that have never supported Trump.
That would be in sharp contrast with the nearly eight years during which the project languished before Obama finally rejected it.
January 24, 2017: Markets opened higher Tuesday and continued a slow and steady march higher for the rest of the day.
The company reported better than expected quarterly results this morning, although the proposed merger with Dow Chemical has been delayed.
Polaris’ small but fast-driving motorcycle business saw sales fall 35 percent to $105.7 million during the fourth quarter.
He touted Pennsylvania as leading candidate for the plant, but said Foxconn is in discussions with other states too.
With more normal weather last year, drought conditions eased, prompting regulators to relax restrictions.
Water districts fear losing the public's trust, he said.
Get the latest news on recent and upcoming IPOs, filings for new issues, and today’s top-performing IPO stocks.
Get 4 free weeks of the IBD Digital edition plus access to IBD's exclusive market analysis, proprietary stock ratings and interactive tools.
All of the companies have been demonstrating strong performance lately, raising concerns of a speculative bubble emerging in the sector.
However, as the companies mature and early-stage difficulties diminish, high reward is met with falling risks.
Stated differently, there is little need to search for additional risk while the leading emerging players remain small enough to outperform.
AP — Uber Technologies is paying $20 million to settle allegations that it duped people into driving for them with false promises.
The pain is particularly sharp in states like North Dakota.
In Oklahoma, the state budget is expected to take a significant hit as tax receipts suffer.
"OklahomaThe commodity's slump has dealt a sharp blow to Oklahoma's bottom line.
The school, work and life hacks you need to get ahead.
We appreciate the president's courage to walk away from a bad trade deal.
Verizon could try to walk away from the deal or lower its price if it thinks the hacks made Yahoo's services less popular.
That metric fell 5.4 percent for the year, and Verizon said Tuesday that wireless service revenue won't start growing until 2018.
It isn't in any way a company-killing event, but it's never encouraging to see that much cash go out the door with nothing to show for it.
The film and music industries, hoping for stronger trademark protections, could suffer, too.
It brings the best, highest quality crude oil from the Bakken to the population centers," Hamm told an industry event in December.
The more sluggish pace of recovery in the housing sector, he said, may reveal the opportunity in that sector for more growth ahead.
The shortage of nurses, he said, was once a hot-button issue.
(Shutterstock)Get the latest news on recent and upcoming IPOs, filings for new issues, and today’s top-performing IPO stocks.
Get 4 free weeks of the IBD Digital edition plus access to IBD's exclusive market analysis, proprietary stock ratings and interactive tools.
Even owners who are organized, keep good books and stay in touch with their accountants can find compiling returns to be a painful process.
"It's very hard to stay on top of all the information," Bravo says.
Even owners who are organized, keep good books and stay in touch with their accountants can find compiling returns to be a painful process.
"It's very hard to stay on top of all the information," Bravo says.
Levy said she would prefer considering the issue as part of the district's larger, longer-range strategic plan.
They'll talk about "the most pressing global issues, notably tackling terrorism, Syria, relations with Russia and cooperation in NATO."
Parents are complaining that the popular holiday toy &#39;Hatchimals&#39; is taking too long to hatch or not hatching at all.21:11
We sincerely apologize and thank everyone who is experiencing an issue for their patience.
The modest language there struck me.
While some of the new shows have earned critical kudos, they did not generate the kind of ratings that could justify their costs.
"His heart is in the right place in trying to do what's best for the economy and jobs, and thereâs nothing wrong with that.
"If we flatten out around 17 million, that's a good place to be," he said.Â But there are still risks.
"For him, the solution lies in driving down battery costs and making future EVs as appealing as possible.
"Following another record-setting year for auto...5 innovations in radiology that could impact everything from the Zika virus to dermatology
The benchmark index has staged a remarkable comeback since losing almost half its value after the financial crisis in 2008.
It’s a good idea to have six months of savings in an emergency fund in the event you lose your job or have a health emergency.
A matching contribution is the best investment you can have; the return is immediate and risk free.
Each of these will offer a tax break while providing retirement savings later.
The new year is a good time to review insurance coverages including life, health, disability, and property and casualty.
With more normal weather last year, drought conditions eased, prompting regulators to relax restrictions.
Water districts fear losing the public’s trust, he said.
No matter whether we are starting, already onto something big or still kicking it small, the journey is tough and the wisdom is hard-gained.
Everyone has their doubts, but the majority think what we are doing is the best way and we often fail to see the long-term effects.
The truth is – there is plentiful of mistakes every entrepreneur makes.
And that cash really doesn’t cover up for your wasted nerves, nor brings you good experiences or further business.
I didn’t have the skills to train my team properly and ended up spending so much time on unnecessary things.
Some mistakes are monumental and so costly that you feel that you will never recover from them.
You will have far more work to get over the regret.
Follow these 10 quotes as living proof that mistakes can be overcome and get successful – as long as you set your mind to it.
âThe refined cobalt market will fall into a 3,000 tonne deficit
The school, work and life hacks you need to get ahead.
And there is no sign of a let-up in policy makers’ efforts to weed out excessive leverage in the financial system.
Members in the focus groups supported one another in the weight-loss journey.
Enter Oprah WinfreyOprah Winfrey is without a doubt one of the most influential women in the world.
Weight WatchersThe fact that the company has used Oprah effectively is not bad.
In this, as seen above, the company has a bad billing reputation.
These risks could affect the company's reputation.
Worse, the complaints could attract class lawsuits leading to an investigation.
Also, at the current price, the risks for an investor exceeds the opportunities.
A setback there for his nationalist party could harm his chances of winning a second term in 2019.
He’s touted 28,000 jobs – “great construction jobs.”The math, however, tells a different story.
"I was waiting for the business to reach a point where we could afford to take the risk."
The legislators' push to punish renewable energy use "clearly picks a preferred energy source regardless of cost.
It is troubling that the U. S. economy has grown at only a 2 percent rate during the course of the recovery from the Great Recession.
Tax reform is an opportunity to address the growth problem.
This allows retirees to keep more of their hard-earned dollars in their pockets and enjoy a better standard of living.
Trump has nominated Wilbur Ross, a wealthy investor who used to scoop up distressed companies and restructure them, for commerce secretary.
Your work and toil will only increase in importance as the times ahead get more challenging.
The legislators’ push to punish renewable energy use “clearly picks a preferred energy source regardless of cost.
The FAA eventually determined that Ali's allegations were substantiated - leading to a $200,000 fine against the airport.
That's because the U. S. government only counts people as “unemployed” if they do not have a job and are not actively looking for work.
While the ratio has improved a lot in the past few years, it still remains stubbornly lower than before the recession.
The bottom line: During the Obama years, the poverty rate fell fastest for Hispanics, shedding an average of 0.63 percentage points a year.
Blacks also saw incremental gains, with the poverty rate falling by about a third of a percentage point per year.
The improvement for white and Asians was smaller, however both these rates had way less far to fall.
Trump has promised to boost the U. S. exporting industry and floated the idea of restrictions on imports, both of which could do the trick.
The dollar was generally weaker despite U. S. shares gaining and the Dow Jones Industrial Average <.
President Barack Obama unveiled HAMP with fanfare in 2009 as the mortgage crisis peaked.
But even in a stronger market there will always be some homeowners in trouble because of a job loss, illness or other setback.
(Shutterstock)Get the latest news on recent and upcoming IPOs, filings for new issues, and today’s top-performing IPO stocks.
Get 4 free weeks of the IBD Digital edition plus access to IBD's exclusive market analysis, proprietary stock ratings and interactive tools.
"The American Red Cross partnered with community groups to distribute and install free smoke detectors for Aberdeen residents Monday.
The American Red Cross partnered with community groups to distribute and install free smoke detectors for Aberdeen residents Monday.
But that's considered a win for the region because of the region's losses in recent years.
Even the U. S., the world’s leading democracy, elected a con artist and would-be dictator as its president.
The U. S. will be unable to protect and promote democracy in the rest of the world.
Putin is not a passive beneficiary of recent developments; he worked hard to bring them about.”Was that wrong?
But a showdown between a corporation in the news and a corporation that publishes the news is often enough a matter of money and power.
Lawsuits are an obstacle to investment or acquisition, and investors prefer to make them go away, rather than fight them on the merits.
The opportunities for pressure or mischief against BuzzFeed investors’ other business interests are ample.
I don’t know if it’s fair to leverage his personal relationships to put pressure on a company because they upset him somehow.
If it is because you are averse to any risk with your funds, cash would be the most safe and the most liquid.
You mention it is not limited to interest, but the gains as well?
The California Drought Monitor published by government and academic water experts shows 42 percent of the state free from drought.
Renters struggle to find affordable housing in the 'missing middle'
The school, work and life hacks you need to get ahead.
A location in Sacramento scheduled a fundraiser to benefit Planned Parenthood but canceled the event after facing intense backlash.
These indicators give coarse, rather than precise, signals.
December new-home sales tumbled to their lowest level in 10 months, but homebuilders keep reporting strong earnings.
(Walgreens)Get the latest news on recent and upcoming IPOs, filings for new issues, and today’s top-performing IPO stocks.
Get 4 free weeks of the IBD Digital edition plus access to IBD's exclusive market analysis, proprietary stock ratings and interactive tools.
The well-established physics of the Earth's carbon cycle is neither liberal nor conservative in character," he added.
The company will also offer those who lose their jobs "income extension" and "other benefits," Fox said.
A revenue beat during the quarter, thanks to a 22% increase, was not enough to offset fears about slowing growth.
The company benefited from better-than-expected sales of cancer drug Opdivo, which grew to $1.3 billion, up from $475 million last year.
Those gains were offset by the 0.4% decline in revenue for its other cancer treatment drug Yervoy, which eased to $264 million worldwide.
In other commodity trading, the price of gold fell $8, or 0.7 percent, to $1,189.80 an ounce.
“There’s a lot more expectations that are positively biased,” he believes.
On the equities side he’s more upbeat on developed markets, which make up a hefty 85% of his stock portfolio.
Slowing growth in the world’s second-biggest economy is well appreciated, but there are other concerns.
Steady crude oil prices and a U. S. shale sector that's proven more resilient than expected have offered a lifeline for the industry.
Despite these differences, experts we spoke with said the Under2 MOU was a strong and forceful compact.
"Will these subnational efforts be enough to prevent a dangerous increase in average global temperature?
"The perception that they'll go to Washington and then favor us is false.
The Alere division that lost government billing privileges, Arriva Medical, is appealing that decision.
Alere has called Abbott's lawsuit "entirely without merit" and said none of the issues cited by Abbott is grounds for escaping the merger.
Both the utility and the agency said the Prineville issue highlights a need for better communication.
As mentioned earlier, the issue will be disposable income from the middle class, which will demand transportation it can afford.
Furthermore, the market's upward march has been steady since it bottomed out in spring 2009, following the financial crisis.
There's also disagreement within his new administration over the effectiveness of tariffs in general.
There's also disagreement within his new administration over the effectiveness of tariffs in general.
"To support the allegations, we performed an extensive analysis of deed records across the country.
As the whistleblower analogized, "it is easier to hide $1 Million dollars in bad loans in $100 Million than $10 Million."
If these securities are related to the loan pools that have been securitized, we believe BANC's balance sheet is at significant risk.
Few concerns facing the United States ― or any nation ― are more important than ensuring children receive a first-rate education.
The nation’s education system has remained steady through poor economic times as well as policy changes.
Click here to see the states with the best and worst schools.
To identify the states with the best and worst schools, 24/7 Wall St. used Education Week’s Quality Counts 2017 report.
Just 2.7% of eighth graders achieve advanced scores in math, nearly the worst standardized test performance of all states.4.
Click here to see the full list of the states with the best (and worst) schools.
The Morning Email helps you start your workday with everything you need to know: breaking news, entertainment and a dash of fun.
ALSOCalifornia regulations for driverless cars stall as other states speed aheadElon Musk wants to dig a tunnel to ease L. A. traffic.
Trending:		Sen. Mike Lee, R-Utah, has already established that he is willing to break from the pack on tax policy.
Their proposal is aimed at fixing some well-known problems of the corporate tax.
Raising the capital-gains tax creates a “lock-in” problem: People will avoid selling their stocks in order to avoid paying the tax.
The economists would therefore switch to taxing capital gains as they are accrued.
Lee would stick with taxing capital gains when they are realized, thus avoiding the need for smoothing but creating the lock-in problem.
issues of sustainability over the past two years.
In 2013 and 2014, state and federal regulators targeted the company over allegations that it engaged in a variety of improper practices.
Get 4 free weeks of the IBD Digital edition plus access to IBD's exclusive market analysis, proprietary stock ratings and interactive tools.
The agreement became effective after the first seven states joined it, but no states have used the compact to issue licenses up to now.
I have my doubts about the long term prospects for OPEC’s recent agreement to cut production, but for now it is definitely supportive.
And business investment in long-lasting goods fell 3.4 percent last year, despite the gains of the last three months.
Trump has ridden into the White House on his image as a successful businessman and an outsider who can single-handedly fire up the economy.
Mary Barra isn’t wrong to point out that simplifying the tax code could boost the economy.
This helped offset some of the weakness from trade.
Its reputation suffered after a racial bias suit alleged the company replaced black employees with white ones.
In 1987, the federal government, following California’s lead, began imposing its own efficiency requirements for appliances.
The four independent contributions include changes in volatility, effective roll costs, interest income, and ETP fees.
This is illustrated by a $100 stock that loses 50% one day (new value = $50), and then gains 50% the next day (final value = $75).
Only the volatility and eRoll components are included (neglecting income and fees) to simplify the example.
For VXX, the isolated volatility component will always track price changes in vol precisely.
Whenever F1/F2 contango exists, which is the norm in calm markets, the eRoll factor works to degrade the price of VXX.
