"It is the consistent weakness in the [pound] which is pushing the FTSE 100 higher," he said.
This slow-and-steady move stands in sharp contrast to the extreme volatility seen both immediately before and after the Brexit vote in June.
There is only one way Australia will start improving, and that is after a major crash.
The Chinese will own and control you by 2050, and you’ll gladly hand everything to them to maintain your ability to buy cheap imports.
Thanks to the LNP all Australians are safe….once we adapt to our new 18 hour days and ‘rat stew’ diets.
The corrupt politicians keep on getting rewarded with victories and honest politicians are constantly driven out.
We Aussies are the elite of the World and this is not a suitable chore for our sons and daughters.
Rudd only got Labor back by promising the same economic policies as Howard, despite how silly it was.
The filthy masses telling the wealthy what to do rather than vice versa ?
😉The problem is when the left fights one of the battles you approve of they get buried in cries of “politics of envy” and “class warfare”.
Well, Australian voters didn’t cover ourselves in glory in any of the issues except slavery.
You had to get out on the street, haggle... or sometimes rent a car and brave the traffic," he said.
"Above all, you're safe... You can work inside an Africab and you don't feel the stress of driving and the traffic jams," Bamba said.
This guys approach to race relations is doing the country more harm than good.
The euro was up 0.9 percent at 0.8827 pounds, while sterling fell 1.4 percent on the perceived safe-haven yen to 137.65 yen.
But any good business lawyer will tell you that companies get into trouble when they shy away from accountability.
But she has me invested in bonds and gold only and insists that we wait until stock prices fall to get back in the stock market.
Big investments in gold are also problematic, given how volatile the prices of this commodity can be.
Federal estate taxes aren't owed if your estate is worth less than $5.49 million, which is the estate tax exemption limit this year.
Hearing the concerns, the state denied Kinder Morgan the right to use eminent domain.
One is the widespread availability of cheap (and even free) online tax-filing alternatives.
Consumer advocates, who had seen the loans as predatory, were thrilled.
AdvertisementThe same advocates are looking warily at the resurrection of this type of loan.
Soon after, the loans effectively died.
The school, work and life hacks you need to get ahead.
They may try to gain compliance by embarrassing or threatening employees.
They abuse their positions of power and they lack empathy for other workers.
The Damage Caused by Working for a Toxic BossIf you’ve ever worked for a toxic boss, you know first-hand just how miserable it can be.
But, when their hard work doesn’t lead to results, their efforts aren’t likely to be sustained over the long haul.
Teamwork failures can result from many factors; understand the underlying dynamics to help collaboration succeed.
And given how often corporate or team directives fall by the wayside, they probably see this as a rational approach.
Have you given them a reason to believe?Or, they may be well-intentioned but overloaded with other priorities.
Choose The Currency That Will Work Right For You:-There are currencies which are not steady and might involve a lot risk.
According to your risk taking the level and your stability you can make a decision which one is right for you to invest in.3.
Analyse what is the forex market condition is and how it can affect you in the positive way or negative.
One major benefit of annuities is that there's no outer limit for contributions.
That said, despite the absence of an up-front tax break for contributing, annuity withdrawals aren't completely tax-free.
Her goal is to make financial topics interesting (because they often aren't) and believes that a healthy dose of sarcasm never hurt anyone.
Even with its unmatched arsenal of turbines, China still lags the United States.
But it is far from the booming cities of eastern China, making transmission of electricity difficult.
"Most of what we call management consists of making it difficult for people to get their work done."
This new player offers -14% fuel burn/seat as well as the #AirspaceByAirbus cabin for ultimate comfort.
While that can be acceptable for a fast-growing company scaling its business, for a more mature company, these are signs of trouble ahead.
In VMX’s case the interest on debt is not strongly covered (ideally 5x) by earnings (earnings are 0.2x annual interest expense).
By a similar token, Donald Trump's winning the   presidency was viewed as a negative for the renewable energy   industry.
Despite these concerns, First Solar looks poised for a strong   rebound in 2017 and beyond.
But while the cyclical energy downturn has been painful, Chart   is positioned to emerge from it even stronger.
Bottom line: Don't let the irrational exuberance of a few   years ago mask the quality nature of Chart's business.
So while there were a few unexpected ups and downs, things were overall fairly stable.
It will make for a challenging opening — with major road work at the entrance.
But the threat of losing, rather than gaining jobs, has not been lost on union officials in the U. S. or Canada.
The Bay Area remained the national magnet for venture capital, although its investment pace fell by a eye-catching 41 percent.
They argued Patrick’s initiative helped to spur startup activity and lure global life sciences giants to the state.
That indicates the corporate sector is actively tackling the debt issue and trying to make the Chinese economy more efficient, he said.
I would be hard pressed to think of a better investing community to be part of in the realm of attempting to find market inefficiencies.
Think back to last summer and you might have a vague recollection of a steady drumbeat of TV ads promoting deals on the Toyota Camry.
With the redesigned Toyota Camry launching this fall, Gulf States is working on its sales events to clear dealer lots of existing inventory.
For one, there's the risk of a 3 a.m. Donald Trump tweet that torpedoes one of your favorite stocks.
The problem is that even the savviest professionals find that timing the market correctly is virtually impossible.
California’s drought conditions have improved in the northern part of the state.
California’s drought conditions have improved in the northern part of the state.
California’s drought conditions have improved in the northern part of the state.
California’s drought conditions have improved in the northern part of the state.
Is the great California drought finally calling it quits?
Is the great California drought finally calling it quits?
He said he had three children and was worried about finding another job with the same benefits, because of his age.
Hillary had deplorable correct, just the wrong group.654
Even worse, the IRS has told taxpayers that they can't even get a portion of their refund back before the Feb. 15 date in the PATH Act.
That will allow the IRS to process the return normally, making the last hurdle for a refund the PATH Act's Feb. 15 restriction.
The U. S. is a safe haven in a turbulent world.
The school, work and life hacks you need to get ahead.
“There is a bit of angst and nervousness leading up to Trump’s inauguration and on the U. K.’s position in Europe.
He appreciates their objectivity — and the fact that he doesn't have to fret over the details.
: http://money.cnn.com/2016/04/20/retirement/retirement-4-rule/Ralph M: I had no idea the hate Democrats have until Trump won.
Hillary had deplorable correct, just the wrong group.655
The latest promise to impose tariffs on imported cars was made to the German newspaper Bild.
It seems impossible to imagine our economy and environment staying healthy for long without them.
Is the great California drought finally calling it quits?
Is the great California drought finally calling it quits?
With assumed debt, the deal is worth $3.2 billion.
While total U. S. rigs fell last week after 10 weeks of gains, the Permian added another rig to 268, or 51% of all U. S. rigs.
Get the latest news on recent and upcoming IPOs, filings for new issues, and today’s top-performing IPO stocks.
Get 4 free weeks of the IBD Digital edition plus access to IBD's exclusive market analysis, proprietary stock ratings and interactive tools.
Ralph M: I had no idea the hate Democrats have until Trump won.
Hillary had deplorable correct, just the wrong group.658
The news is encouraging for a region that has spent 10 years recovering from the housing market collapse.
He suffered from what I call the “smartest guy in the room” syndrome.
The culture of the company and its operations issues were beyond repair if he continued to lead the company.
She succeeds Roberta L. Hacker, who retired in the fall after leading the group for nearly 30 years.
Rakers also expects the company to benefit from increased sales of hardware to "hyper scale" cloud computing providers.
But they’d be manageable, not catastrophic.
Ultimately the only meaningful way to reverse China’s debt dependence is to boost consumption as a source of growth.
Another economically destructive dynamic frequently kicks in.
(Not entirely a choice: Mother went from making big money to being unable to work.)
If I had a $20 for every idiot I saw who'd bought a house, with no good reason to buy a house, because "the tax write off"...
But, I realized too late that, having them grossly over withhold on their paychecks was what a good salesman would do.
The more you focus on the noise of the machina the less attention you pay to the people behind the curtain who benefit from the noise.
Despite concerns, most members are optimistic about the local economy.
Health care and its rising cost has been a top issue for members for the last decade.
That's because the US population is aging, and older investors tend to favor lower risk investments, such as bonds.
Financial firms are excited about Donald Trump's promise to roll back many of the regulations enacted after the 2008 financial crisis.
Successfully navigating the new environment will require discipline, courage and strong risk management skills.
He was ranked as the richest person three years ago, but saw his net worth hit by a downturn in Latin American economies.
Shopping malls are losing a great deal of customer traffic to online retailers like Amazon.com (NASDAQ:AMZN) and others.
Comparable-store sales fell 1.4% last quarter, which is a bad sign that the company's established stores are not bringing in enough traffic.
The company posted a 2.1% decline in comparable sales over the final two months of 2016, which was toward the low end of its guidance.
This was a major disappointment, as November and December are the most important months for department stores.
Kohl's followed Macy's lead and reduced its own earnings forecast for the full year, based on many of the same difficulties.
In such an environment, if you are already rich you have to try hard not to keep getting a lot richer," the report claims.
Still, the city's serious problems make unclear how far the revival will go.
And in a city nearly evenly split between whites and blacks, the vast majority of violent crime victims — and assailants — are black.
"Still, the city's serious problems make unclear how far the revival will go.
And in a city nearly evenly split between whites and blacks, the vast majority of violent crime victims — and assailants — are black.
All things considered, I think that makes Chipotle a perfect candidate for a stock the market loves to hate but that you should love.
Soon they will add a third joint venture to the mix, JAC-Volkswagen, which will sell affordable electric cars under a yet unknown new brand.
Despite such worries, a fair number of CEOs are bullish on their own companies’ near-term outlooks.
Some 44 percent of respondents said that globalization has done little to help close the gap between the world’s rich and poor.
In DIT’s case the interest on debt is well covered by earnings (7.3x coverage).
Ralph M: I had no idea the hate Democrats have until Trump won.
Hillary had deplorable correct, just the wrong group.661
Another pressure is climate change, as more intense weather events fuel a need for improvements to wastewater facilities.
Don’t wait until the night before your annual review to write down all your accomplishments (or worse, try to wing it during the meeting).
That means the value of people's savings shrinks over time — a constant risk with conservative investments, to be sure.
But he added that it would be "correct, if the ECB began this year to look for the entrance to the exit'' from its ultra-cheap money policy.
That bullish bent comes even though the brand has no franchisees or locations in North Texas.
He suffered from what I call the “smartest guy in the room” syndrome.
The culture of the company and its operations issues were beyond repair if he continued to lead the company.
QQ was at last look down 11% on the TSX Venture Exchange, losing near half of Monday's gains around 20%.
What’s less clear is whether this is a net positive or negative, and surely the answer varies from one person to the next.
She succeeds Roberta L. Hacker, who retired in the fall after leading the group for nearly 30 years.
For example, the burning of coal has declined, not because boycotts worked, but because it’s not as efficient as other fuels.
One is the widespread availability of cheap (and even free) online tax-filing alternatives.
Consumer advocates, who had seen the loans as predatory, were thrilled.
The same advocates are looking warily at the resurrection of this type of loan.
Some well-timed intervention that burned the fingers of dollar bears also helped.
Throw in a president that is happy to tweet whatever is on his mind and the stage is at least set for volatility.
"Still, the city's serious problems make unclear how far the revival will go.
And in a city nearly evenly split between whites and blacks, the vast majority of violent crime victims — and assailants — are black.
Dr. Jerry Weber of the College of Lake County also touted the benefits of the Ecosystem at work.
And the lifestyle you will be trying to continue in retirement won't be as costly as what it might have been without the saving.
"We also see the potential revival in already anemic private investment taking far longer than we originally anticipated,"  Kundu added.
There is still much to iron out with the deal, and there is fairly stiff opposition to the project in New York.
He said he had three children and was worried about finding another job with the same benefits, because of his age.
Still, the attempt to reduce fraud "is a positive thing overall," said Greg Rosica, tax partner at Ernst & Young.
Like the Additional Child Tax Credit, the EITC is refundable, meaning that even if you have no tax liability you can get a refund.
Still, the attempt to reduce fraud "is a positive thing overall," said Greg Rosica, tax partner at Ernst & Young.
"Like the Additional Child Tax Credit, the EITC is refundable, meaning that even if you have no tax liability you can get a refund.
It is these hollow remedies, rather than the findings of liability, that are the most interesting aspects of these challenges.
AdvertisementThe problem with many constitutional law remedies is that they are too big to succeed.
It’s a wonder corporations bother.
They come in like a lion, purporting to hold powerful and well-established bureaucracies to be unconstitutional.
The school, work and life hacks you need to get ahead.
So the timing seems right.”Other companies, too, have recently touted their commitment to creating domestic jobs.
It’s worth noting that automakers are slow-moving entities and typically put years of thought and planning into every business they make.
With doubts growing about the sustainability of the Trump trade -- higher stocks and stronger dollar -- safe-haven assets glittered.
“As demand grows, they will go to the more expensive, more difficult, less prolific.
Meanwhile, the company maintained a solid balance sheet, with long-term debt remaining unchanged while the cash balance increased.
He said his progress has only been hampered by the fact that few are currently willing to sell.
This December's rebalance of dividends from $10k invested fell well below the aggregate single share price of the 10 stocks acquired.
This gain estimate was subject to average volatility 37% more than the market as a whole.
- Fredrik ArnoldThe net gain/loss estimates above did not factor in any foreign or domestic tax problems resulting from distributions.
By the end of 2015, Ematum was in deep water and sinking fast.
Some of this slowdown can be attributed to unfavorable weather and tough year-over-year comparisons.
That said, J. C. Penney is clearly suffering from the department store sector's broader malaise.
(For example, J. C. Penney has maintained its earnings guidance throughout the past year despite its disappointing sales performance.
While those store closures may have helped J. C. Penney somewhat, the company's comp sales performance has still been unsatisfactory.
The latest promise to impose tariffs on imported cars was made to the German newspaper Bild.
American Apparel is not the only once-successful retailer that has faltered.
There have been concerns that the resulting rise in oil prices would provide incentive for U. S. producers to boost oil output.
California’s drought conditions have improved in the northern part of the state.
California’s drought conditions have improved in the northern part of the state.
They asserted the series was "clearly derived" from their work and wanted credits and damages.
In a statement, Navient called the bureau’s lawsuit “unfounded” and politically motivated.
1:02 PM ET Oil prices fell Wednesday, reversing earlier gains, after the head of the International Energy Agency predicted a rebound in U.
(TNS/Newscom)  Get the latest news on recent and upcoming IPOs, filings for new issues, and today’s top-performing IPO stocks.
Get 4 free weeks of the IBD Digital edition plus access to IBD's exclusive market analysis, proprietary stock ratings and interactive tools.
On Wednesday, the dollar recovered from Trump’s comments on Tuesday, who said a strong dollar can harm the U. S. economy.
Theresa May opts for a clean break with Europe.
The trouble is that, for all her pleasing rhetoric, Mrs May is not really pursuing this vision.
But she was less honest in not admitting that Brexit will impose costs, and that a hard Brexit will make them heavier.
Mrs May’s response that the economy has done better since the referendum than economists forecast is disingenuous.
As she conceded, the other 27 EU countries have been impressively united over Brexit.
Mrs May made helpful noises about not wishing to see the EU unravel, unlike Donald Trump.
There's a reason the IRS tends to get a bad rap -- it likes to stick its fingers into whatever earnings you manage to get your hands on.
On the other hand, if you receive $1,000 a year in qualified dividend income, you'll lose just $150 to taxes.
Her goal is to make financial topics interesting (because they often aren't) and believes that a healthy dose of sarcasm never hurt anyone.
A strengthening dollar can hurt U. S. growth by making exports less competitive.
Ross, 79, made a fortune buying up failing companies, improving their financial performance, and often selling them at a profit.
Donald Trump took aim at NBC's Today on Wednesday, claiming the morning show is "doing so badly compared to its glorious past."
"He then added, "No wonder the Today Show on biased @NBC is doing so badly compared to its glorious past.
"No wonder the Today Show on biased @NBC is doing so badly compared to its glorious past.
The company hemorrhaged elite fliers, saw fresh labor strife and lackluster operational performance.
"Millman said White Marsh is still a good spot for an outlet mall, which could pique the interest of other developers.
The balance sheet of the company is in excellent condition with total debt at just over $11 billion.
Although earnings were mixed, the acquisition price of the recent deal also had an impact as well as cash flow issues.
It maintains the flexibility to raise debt or sell noncore assets.
The major concern, political analysts said, is that members of Congress will help pass laws to benefit companies in which they own stock.
It more than made up its loss from the prior day, and continues the steady march higher that bond yields have been on since Election Day.
The decline in builder confidence comes amid heightened concerns about mortgage rates, which have been mostly rising since early November.
Readings above 50 indicate more builders view sales conditions as good rather than poor.
But the cheap loans that have supported stronger sales may be vanishing.
The decline in builder confidence comes amid heightened concerns about mortgage rates, which have been mostly rising since early November.
Readings above 50 indicate more builders view sales conditions as good rather than poor.
But the cheap loans that have supported stronger sales may be vanishing.
Some activists released statements suggesting that the president's latest push for criminal justice reform falls short.
Re/Max of Georgia said there were 3.2 months worth of homes for sale in December, a 12 percent decline from a year ago.
"We cannot let such tactics distract us from the more important issues.
"I get the criticism, but we don't have enough jobs in Cecil County.
Stevinson was willing to make considerable concessions to make his proposed car dealerships compatible with the natural area.
Russia is party to a non-OPEC commitment to curb output and OPEC said production at the tail end of last year was "more or less stagnant.
It had plans to demolish the existing structure to clear the way for the new office tower.
The school, work and life hacks you need to get ahead.
"We tried to work with the [Labor Department] regarding this matter and resolve any concerns.
In September, a California court rejected the case and awarded Twin Hill legal fees from a few attendants who did not drop their claims.
Industry TrendsWhile I called 2016 the "year of tough decisions," I'd characterize 2017 as "the slow road back."
"Demand may well turn out to be the dark horse of 2017," said Virendra Chauhan, analyst at consultancy Energy Aspects.
"Business and finance are the change agents that will spur innovation, unleash investments and see the SDGs achieved.
Pennings ha committed no crime and voluntarily came to the US to clear his name,’’ Burlingame said.
"Relative to our baseline, the risk clearly skews to three hikes
more productive, or address the root causes of inequality.
can lean against damaging fluctuations in the economy.
"The extraordinarily severe recession required an extraordinary
prices are stable, will be significantly slower than the
Citigroup's $3.7 billion trading haul was its best fourth-quarter showing since the financial crisis.
The hum on bank trading desks also reflects a bout of volatility after years of calm.
The strong 2016 finish was a welcome respite for trading desks that started the year in a deep slump.
Sluggish trading, though, had been a problem for banks for the better part of this decade.
The bounce was particularly strong in fixed-income products, which include corporate and government debt, currencies and commodities.
The performance helped shake the belief that the business was in secular decline.
When comparing the euro zone and the U. S., it’s useful to look at purchasing manager indexes, which are critical bellwethers of growth.
Although the pace of inflationary is still relatively slow, the acceleration was sharp -- and unexpected.
The euro may be the euro zone’s ugly baby, but EU members have to love it.
“We believe we have strong, principled defenses to its complaint,” Goldman wrote in an email to the AP.
"If it's simply an oversight on your part, you can usually just write a check for the taxes you missed to clear up the matter quickly.2.
Many of those problems are not important enough to draw the attention of senior leaders.
The program comes as Amazon's hard-charging work culture and its impact on employees faces increasing scrutiny.
It could also shed a positive light on Amazon's work environment that's often been described as being more hostile than other companies.
Eric Creizman, Lumiere's lawyer, told reporters his client would likely appeal, while Lumiere's family reacted angrily to the verdict.
"The agency will "work to recoup losses and compensate victims.
About 2 percent is in “exceptional drought,” the worst category, down from 42 percent a year ago.
The market will not be patient for inaction over the first several weeks.
The best news from the earnings report was the drop in leverage to a 5.3× debt-to-EBITDA ratio, 0.2× better than the company had planned.
These comments were intentional, and a recognition that local debt markets will ease the central government’s fiscal strain.
Bush, however, encountered a recession toward the end of his term, which led to his defeat at the polls in 1992.
Two Democrats enjoyed horrible election-to-inauguration markets – with buoyant results for the next part of the year.
This optimism fed a Dow rise throughout his first term, but after that the index sagged anew as the Depression ground on.
Bespoke didn’t include vice presidents who got the top job after their predecessor died.
When customers appear to fall behind on savings goals, Ellevest nudges them to get back on track, telling them how to adjust.
