But if populist candidates triumph in coming votes, the prospect of a eurozone breakup could return to markets.
“It’s not only the water loss but also loss in revenue, so it makes sense to do water audits for a variety of reasons,” Lopez said.
we spent way too much time on it, we didn't make any money on the damn thing, but we were proud of it.
Perhaps too popular: Years after opening, there was a stink about people who'd moved into the privately run campground and stayed .
Brown is predisposed to see the glass as half-empty, rather than half-full, and has consistently warned about an overdue recession.
Opposition politicians on the left have lent support to calls for protests against the deregulation.
Manley said the new structure will cure a “terminal illness” by adding 300 more spaces in that block.
"Last year, we were anticipating a rough start to the year because of earnings, and then stability.
All capital gains or losses as well as dividend income have been generated as a result of the original amount invested.
The most significant was Kinder Morgan's (NYSE:KMI) severe dividend cut at the end of 2015.
The U. S. market provides a level of stability that is unimaginable in many parts of the world.
The dollar's break to the upside creates a bullish signal as long as the Dollar Index stays above the 100 support level.
A strong break below the 100 level would be necessary to negate the bullish signal.
Any weakness in the euro would help to support the U. S. dollar.
"There's been a lot of emphasis on this concept of equal pay for equal work," Frank said, but that focus misses a bigger issue.
"The concept of unconscious bias is really important," Frank said.
The actions effectively put more than 125 million acres in   U. S. offshore waters off-limits to future leasing.
In addition, most of the few   leases that remain outstanding are set to expire in 2017.
Then the willingness to delay rose to 70.3 percent (no work while waiting) or 55.5 percent (working half-time while waiting).
The survey also found that people would accept less than the fair amount of $60,000 to delay claiming.
It fell to 30 percent if they had to work half-time during the wait, and the average dollar amount required to wait went up to $61,406.
The school, work and life hacks you need to get ahead.
The company says it can’t justify expensive replacement of a system that still works well, according to industry reliability measures.
They’re at risk of losing channels including USA Network, Bravo, MSNBC, and CNBC, as well as stations owned by NBC and Telemundo.
Because New Year's Day falls on a Sunday, government offices will be closed and there won't be any mail service.
President faults mass action calls by the Opposition as Cord leaders Raila and Musyoka vow to defeat Jubilee in
For the full year, casino revenue fell 3.3 percent to 223.2 billion patacas, easing from the 34.3 percent drop recorded in 2015.
The school, work and life hacks you need to get ahead.
It's not that big of a problem when a 30-year-old has no significant retirement savings, as they still have time to fix the problem.
These employees are losing out on $1,336 per year, on average, in free money.
Meanwhile, inflationary pressures at the factory gate edged higher having eased slightly last month.
That way, you'll be ahead of the curve and in a   better position to adapt to any unexpected obstacles down the   road.
If the forecasts are accurate, the median for existing homes – still lagging prerecession highs – also will set new records this year.
However, the struggle to ensure the Buckeye State focuses on a more innovative, modern electricity system continues.
Rather than hang a "closed for business" sign on state borders, Ohio needs to welcome competitive entrepreneurs.
The good news is that we've admitted both of those problems, if not exactly solved them.
Even the more obtuse public officials dimly understand the need for infrastructure investment to support a record, and growing, population.
True, the stops are climate-controlled, accessible to the handicapped, and nice and new—but they're still just three stops.
So what went wrong with the new, improved—and, come Saturday, existent—version of Second Avenue Subway?
Firms could work all night and day simply digging out dirt and flinging it to the side under “cut and cover” construction.
These are hard jobs to do, and merit good pay.
It's hard to believe that the purpose of our long-standing mandates on American companies are to protect us from well-paid Finnish workers.
Yet over and over, one contractor's delay cascades into delaying other contractors from starting their work.
Separating the transit system from the rest of the city and state budgets was supposed to ameliorate this problem, but it hasn’t.
Retailers are bracing for a fresh wave of store...5 innovations in radiology that could impact everything from the Zika virus to dermatology
No doubt the novelty of it will attract lots of riders; everyone will try it once.
That could ease fears that the Qline will need at some future point to go begging for more money from somewhere, perhaps the state.
It’s the pricier but more reliable option, Ritchie said.
People should have confidence that their water system won’t fail on them.”At the Harry Tracy plant, machines churned and hummed.
When it comes to bank stocks, there is no clear line between cheap and expensive.
And over the past eight years, Bank of America has absorbed $191 billion worth of crisis-related costs.
Your boss is either a strong leader by now or a wimpy 'yes man' or 'yes woman' without a functioning leadership bone in their body.
My boss doesn't stress or obsess about tiny things like whether someone walks in the door to work at 8:30 or 8:35.
If it were a good career move for me, my boss would completely support me in leaving their team even though they would be sad to lose me.
Further, even with modest deregulation in the U. S. the regulatory environment remains complex and continues to evolve globally.
After spending 2016 making money in gold and miners and then getting the hell out just after the top I feel pretty good.
Meanwhile, trade safely, buckle up, and get ready for the ride of your life which is not recommended for amateurs or the weak of heart.
does everything they can to respect the rights be it "fair use" or creative works however, some people object.
Hannappel's estimate is somewhat less optimistic than others, but the oil industry's view of electric cars seems to be downright negative.
This year, as with 2016,   contribution limits are $18,000 for employees under the age of 50   and $24,000 for those aged 50 and up.
Best of all,   the money pulled out is penalty-free and tax-free.
The contribution limits in 2017 are   $3,400 for an individual and $6,750 for a family.
An ASP is the perfect excuse-killer for those of you who struggle   to save and invest.
The snow may be falling, but optimism is riding high for Wall   Street and investors as we dive headlong into a new year.
At the same time, Barrick has done a remarkable job of   reducing its expenses and debt    .
The best news for shareholders is that Skechers' issues in   2016 are probably going to be confined to just a few quarters.
Skechers' aggressive expansion plans outside the U. S. should   also intrigue prospective investors.
Just how much benefit further regulatory changes could bring is less clear, although investors are betting they will do more good than harm.
High interest rates help increase the debt in a very rapid way.
Get 4 free weeks of the IBD Digital edition plus access to IBD's exclusive market analysis, proprietary stock ratings and interactive tools.
In other words, no person can be made better off without making someone else worse off.
There are several big objections to the free-market-as-nirvana view of economics.
General-equilibrium theory assumes perfectly competitive markets made up of businesses that all set prices at marginal cost.
Such sand in the wheels is fatal to the socially efficient outcome of general-equilibrium theory.
Safer, or defensive, stocks on the index went up only 4.6%, despite having outperformed since the financial crisis.
The question is whether companies will prove profitable enough to justify the market's risky bets for 2017.
Investors are slightly more optimistic about economic prospects in the eurozone and Japan, two regions plagued by years of feeble growth.
The complaint seeks relief from directly assigned Z2 obligations and a refund for payments already made.
Generally speaking, buyers looking to purchase a home in the dead of winter are doing so because they have to, and the sooner the better.
In a bleak 2015, the Partners Fund fell 18.8%, starkly lagging the 1.4% gain for the S&P.
The depressed pricing situation caused the fund to anticipate a strong rebound.
"We are working hard on infrastructure to get ready for the growth.
Our electric system, well, the bottom fell out on that this past year but we are in a good direction now," he said.
"They have broken ground but rains have pushed them back 30 days in their construction progress.
They know I didn't make the mess at the site but I am going to clean it up," Lee said.
The garnishment of his Social Security checks stopped and the outstanding $12,000 in student debt was wiped away.
He's happy to have the money back in his pocket each month, but is apprehensive about what comes next.
He became well known for his efforts to keep his firm going after it lost about two thirds of its employees during the attacks of Sept. 11.
The patterns are relatively easy to spot, the reward potential of the trade outweighs the risk, and they can be traded in a variety of ways.
Using the same stop loss levels, the risk/reward of the trade is greatly increased.
This provides a better risk/reward but less confirmation from the price (no breakout yet).
"There's been a lot of emphasis on this concept of equal pay for equal work," Frank said, but that focus misses a bigger issue.
"The concept of unconscious bias is really important," Frank said.
However, if it is well-established that the dependence on a primary product is a key supply risk, the opposite is also true.
The series raises these important questions: What can and should be done to expand opportunities for the poor?
There’s often neighborhood resistance, as well as questions about land availability and costs.
Promoting community building and public safety are also important in the fight to address poverty.
All of society benefits when there are more paths out of poverty.
Some of these growth stories have been stunning with stocks tripling or more despite junk debt and lack of economic growth.
"This fallout from the Fed's tomfoolery with creating an artificial market in everything looks like a windfall "subsidy" for the banks.
The weak banks being gobbled up by the strong is making the players left fewer and stronger.
And I made this observation:There we saw a nice climb for stocks even though we were entering the weak economy of '80-'82.
Why does the business elite of Little Rock like launching some of Wall Street's biggest growth behemoths from these backward hills?
Another area resident, Eunice Ladd, who lives on Genesee Street across from the proposed apartment buildings, filed an objection as well.
But “we don’t know exactly what the impact will be.”One thing is certain: Things are likely to get worse before they get better.
Once the frost leaves the ground in the spring, the scope of the work expands.
Brown is predisposed to see the glass as half-empty, rather than half-full, and has consistently warned about an overdue recession.
The school, work and life hacks you need to get ahead.
At this rate of deterioration, China, and its "goalseeked" 6.5% annual growth rate may soon regain the top spot among world economies.
The little guy gets hurt?That's an added benefit!
I wonder if I am siding with the wrong team.
Commenting on his appointment, Peter said: "I am excited to take on this critical role at Aon in this era of the new normal.
What's the most daring career risk you've ever taken?There were a lot of those in the early days!
It's the tie to SunEdison that's led to 2016's ups and downs, and breaking free would be a huge positive.
And in a restructuring of the company, it might make sense to reduce debt and offer creditors shares of stock.
The maximum survivors benefit is limited to what they would receive if they were still alive.
Offer from the Motley Fool: The $15,834 Social Security bonus most retirees completely overlook
The indexing trend isn’t new, but it accelerated after the 2008 financial crisis, when most fund managers failed to avoid sharp losses.
Even the managers of the elite Harvard endowment have turned to indexes for US equities, unable to outperform them at a reasonable price.
Cat litter has helped the industry ride out the oil and gas downturn, said Wyoming Mining Association Executive Director Travis Deti.
In all, the survey determined that state residents favored a ban by a 56-28 margin with 16 percent undecided.
The potential adverse impacts include damage to human health, clean air and water; excessive noise pollution and even microearthquakes.
If at some future date, the risk is more manageable and the demand for the resource is more robust, perhaps the moratorium can be revisited.
Gold  was sluggish, with the precious metal sliding about 0.1 percent to $1,150.82, after a flat start to the year on Monday.
The company gained steam, snagging model Cindy Crawford as a brand ambassador and partner, as well as more than $5 million in funding.
Whether that will be enough to bring a simmering feud between the two sides to an end is uncertain.
"We're looking for what works best today rather than giving them limitations or guidance.
"We are less concerned with the project cost than we are the benefit to community," City Manager Doug Krieger said.
In it, the city’s plan to build a new central subway — also scheduled to open in 2019 — helped alleviate traffic concerns.
Most spend their lives amassing their fortunes by working hard, spending little, saving a lot and investing wisely.
Short-term gratification is not worth the risk.
That’s easier in some fields, like making drugs that fight cancer, and than in others, like making soft drinks.
When employees were allowed to deviate from the script, they had happier customers and increased sales, he said.
Still, the strike is keeping crabbers and others in related fields, like trucking and processing, out of work.
“The design was beautiful; they had things we could add or subtract.
After his election win, Trump touted a deal to save jobs at a furnace factory in Indiana but inflated the number of jobs preserved.
“There’s just not a lot of demand for it.”The Cruze sedan manufactured in Ohio has suffered from weak demand as well.
Here's a quick look at why these companies are both worthwhile investments, and why their stocks look cheap.
(Credit: AP / Richard Drew)         U. S. stocks broke a three-day losing streak Tuesday and ushered in the new year with broad gains.
S. stocks broke a three-day losing streak Tuesday and ushered in the new year with broad gains.
Cat litter has helped the industry ride out the oil and gas downturn, said Wyoming Mining Assn.
The tariff saved 1,200 U. S. tire jobs, which had been in sharp decline.
"The best thing about the tire tariffs is that they expire," Hufbauer wrote in 2012.
Since sanctions eased last January, the producer has doubled exports as crude prices rallied.
The school, work and life hacks you need to get ahead.
They also illustrate that one of Mr. Trump’s particular points of criticism, manufacturing in Mexico, has become particularly sensitive.
Those numbers fall well short of the goals in the city’s ambitious climate action plan, which was approved a year ago.
As long as Trump's trade policy is limited to this rhetoric, the harms are probably not too great.
He was referring to the lead water crisis in the the Michigan city.
They were doing such a good job of turning our beloved country into a socialist slave state.
This was the second cut in the past two quarters for the fund and is part of a worrisome trend in tax-free municipal bond funds.
The Dow option-income fund, DIAX, which has had something of a disappointing record previously, was an exception with its 4.02% gain.
It's clear that the losses in the equity funds are a reflection of inadequate diversification within the category.
This could be a very positive sign — or a very negative one, depending on their reasons.
Yes, automation, not factory relocations overseas, is the main cause of our loss of good-paying factory jobs.
So a sudden jump in good-paying industrial jobs for hard-pressed middle-income families is a cause for cheer in the new year.
Or out of fear they'll be singled out in one of the president-elect's famously acidic tweets.
The lure of protectionism in the form of higher tariffs is strong, but ultimately it's a tax that all of us pay.
Get 4 free weeks of the IBD Digital edition plus access to IBD's exclusive market analysis, proprietary stock ratings and interactive tools.
"By late fall, it was very clear we didn't need the capacity, and we made the decision.
Trump avoids punitive tariffs to prevent a trade war and develops a more cooperative relationship with the world’s second largest economy.
The US-China relationship ended 2016 under a dark cloud as US president-elect Donald Trump promised to play tougher with China.
If candidates lack the unteachable qualities, they won’t be successful and we have to consider a different role for them.
“No one likes to lose a top performer, let alone fire them.
This is also the number one problem in sales: We all love talking about ourselves.
Refugees tend to make long-term commitments to work, he says, at a time when there is a talent shortage for highly skilled jobs.
It is hard work, but it paid off for Ray Hermez, who works on the production line boxing finished cakes.
"With a pinch of skepticism and a dash of fun, The Salt covers food news from the farm to the plate and beyond.
But “we don’t know exactly what the impact will be.”One thing is certain: Things are likely to get worse before they get better.
Once the frost leaves the ground in the spring, the scope of the work expands.
So we want to be prudent,” Brown told reporters last month after the state reached a tentative agreement with SEIU.
The FCC made clear several years ago that it had concerns about consolidating the already small cellphone market.
The flip of the calendar into 2017 marks the end of capital loss tax selling season, now replaced by capital gains tax selling session.
This seasonal tendency can trigger major declines in current market leadership, setting the stage for a new set of superior performers.
Last week’s high volume reversal may signal the first stage of that decline, but bears have work to do to break highly positive sentiment.
On Balance Volume (OBV) breaking the red line with a lower low could also offer a useful timing signal.
As a result, the sector’s strongest performers could get sold in coming weeks, with downside pressure continuing as the year unfolds.
The stock doubled in 2016 after a rocky start, carving a stairstep rally that’s printed a number of narrow support levels.
And, whether you die or not, some of the $5,000 will be given to an environmental protection fund; so at least there’s that.
The market has remained above this trajectory in the entire move higher that has corrected the sharp downturn in the first half of 2016.
The restaurant industry largely held prices steady after the recession, in a desire to prop up sales while customers remained skittish.
Visits to fast-food chains, which make up a majority of overall restaurant visits in the U. S., fell for the first time in five years.
One of the first things many people try is consolidating their outstanding debt under one bill.
One of the easiest ways to refinance your credit card debt is to open a new balance transfer credit card and move your balances to it.
Despite the fact that most cards charge you a small fee upfront, it is almost always a good deal to consolidate your debt using them.
Another good way to consolidate your credit card debts is to take out a separate consolidation loan.
Even if you feel confident about your ability to repay the debt, the risk is too great.
Once you figure out the best vehicle for consolidating your credit card debt, you should take the time to come up with a repayment plan.
Decide how much you can afford to pay towards the debt on a monthly basis, and try to estimate how long it will take to fully pay off.
Therefore, it’s generally not a good idea to throw all your money towards paying down your debt.
The school, work and life hacks you need to get ahead.
Advancing issues outnumbered declining ones on the NYSE by a 5.84-to-1 ratio; on Nasdaq, a 3.44-to-1 ratio favored advancers.
"There are clear worries about the secondary impact of what a tighter monetary policy is going to do," he said.
Trump’s proposal to tariff imports from China and Mexico, which are among the U. S.’s top trading partners, ignited fears of a trade war.
Chinese stocks continued plunging in the New Year on worries Beijing is letting the yuan depreciate too fast against the dollar.
He has criticized Ford, General Motors and Carrier on Twitter for shuttling work south of the border.
DNR officials say there is no agency appeal process for the rejection of the sublease.
But there are a few things worth considering before getting too worried.
"But if people don’t save enough in their 401(k)s because their contribution rates are too low, that’s a problem.
"Others contend that policy changes and better business practices would help workers make smarter provisions for their own futures.
Stay up to date on the drought, winter storms and other news with our free mobile app.
Get 4 free weeks of the IBD Digital edition plus access to IBD's exclusive market analysis, proprietary stock ratings and interactive tools.
Business investment in equipment and new technologies has been lacking - but businesses are actually optimistic on the future.
If it was positive there would not be so many conflicting articles8.1k
"Ford's boost was much smaller, just 0.3 percent, for the month -- but still beat forecasts, which anticipated a sales decline.
Nonetheless, even it contributed to the industry boost last month, as experts thought Chrysler would see a decline of 11-12 percent.
Momentum and trend following advocates will probably shy away from the weak relative performance and lack of attractive technical cues.
On the flip side, many will see the weak one-off year as the potential for an undervalued area of the market to make a significant comeback.
Some measures that are more defensive, such as hikes in the minimum wage, are also gaining traction.
In London on the Intercontinental Exchange Europe, Brent crude, used to price international oils, gained 98 cents to $56.45 a barrel.
Fiat Chrysler, which rose Tuesday, missed out on the gains and was little changed.
If it was positive there would not be so many conflicting articles8.1k
Having stemmed some of its losses, he says Macy's can now pour some of the savings into improving stores that show more promise.
But efforts fell short in the all-important holiday shopping period.
Theme park reporter Dewayne Bevil does the hard work for you.
Theme park reporter Dewayne Bevil does the hard work for you.
Dean's familiarity with the company, however, could trump that concern.
However, companies can depreciate equipment that doesn't qualify for the Section179 break, and get a deduction that way.
"This inflection in HCIT demand should relatively favor Athenahealth's single-instance, multi-tenant cloud-based model," Hooker wrote.
He upgraded Athenahealth stock to overweight from a sector weight and kept his 140 price target.
Get 4 free weeks of the IBD Digital edition plus access to IBD's exclusive market analysis, proprietary stock ratings and interactive tools.
“That’s the scary part.”Error message'As for what Trump would like to see the Fed do next, “that’s not clear at all,” points out Pascualy.
Honestly, increasing the minimum wage is probably not the ideal way to combat poverty.
The Earned Income Tax Credit (EITC), which provides a refundable tax credit for poor families is a better tool.
The EITC has historically enjoyed substantial bipartisan support, but that has not prevented it from falling victim to toxic partisanship.
The absurdity of the situation is even more apparent when one considers that many workers earning the minimum wage qualify for food stamps.
In an ideal world, there would be better solutions than raising the minimum wage, but raising it will assist many poor families.
The larger issue here is that the D-Backs are already trying to secure a new ballpark, before Chase Field hosts its 20th season.
There is no benefit and nothing positive about this ill conceived and badly implemented "demonetization".
But G. M. exemplified the market’s split personality, as several of its smaller cars experienced sharp declines.
The real estate investment trust disclosed that it would terminate the leases on 19 unprofitable stores that had been sold off to it.
According to some bond managers, a big issue holding back the funds has been their reputation for being a bit too freewheeling.
That creates the perception, fairly or unfairly, that they may take undue risks to chase returns.
“Retaining employees will be hard work.”Beaulieu does see serious problems on the horizon.
The REIT sector does wonderfully during periods of low or declining interest rates.
