Life vests inflated, they were given the duration of Celine Dion’s “My Heart Will Go On” to find a way to stay warm while floating.
The pop music was supposed to ease anxiety.
An instructor is poised behind the participants the entire time, ready to whisk them to the surface if anything goes wrong.
Standing by the pool, still dripping, she said she felt “a little more at ease with my whole fear.
Housing advocates fear the move could displace poor families during a time of affordable housing scarcity in cities like Grand Rapids.
“We’re losing a very precious resource there.
“The public policy (crafted back in the 1980s) anticipated that someone might try and thwart providing that subsidized housing.
However, last month the Supreme Court denied the request for an appeal.
It's a tactic, they say, to delay development of the property and to improve the neighborhood.
In turn, the stronger dollar makes U. S. exports more expensive and U. S. imports cheaper.
Get 4 free weeks of the IBD Digital edition plus access to IBD's exclusive market analysis, proprietary stock ratings and interactive tools.
This effort is a transparent attempt to manufacture an excuse to defang the CFPB.
If predatory lenders succeed in undermining Director Cordray and the CFPB, we will revert back to lax financial regulations.
It could also cause yet another painful economic crisis caused by big banks and predatory lending that we simply cannot afford.
We can’t afford to lose Cordray’s leadership or diminish the role that the CFPB plays every day to support hardworking Americans.
The mall owners "hope to restructure existing debts and return to operating the Fashion Square property at a profit," Shuker said.
Why aren’t stocks looking through the “jobs weak, Fed on hold” dynamic to be concerned about these deeper economic issues?
According to some bond managers, a big issue holding back the funds has been their reputation for being a bit too freewheeling.
That creates the perception, fairly or unfairly, that they may take undue risks to chase returns.
They may have good reason to do so: About a third of those surveyed said that their financial life was worse than they expected it to be.
Since it's a pure-play driller, investors have to take on the   volatility of commodity prices.
And tax cuts from President-elect Donald Trump and Congress, plus a possible rate hike from the Fed, won't hurt.
Get 4 free weeks of the IBD Digital edition plus access to IBD's exclusive market analysis, proprietary stock ratings and interactive tools.
It sank at the start of the year on worries that a sharp slowdown in China’s economic growth would pull down the rest of the global economy.
"One of the things that government is rightfully criticized for is being inflexible and impractical," he added.
The problem with defined benefit plans is they were always an expensive promise.
Employers must put aside enough money to fund long retirements and bare all the market risk.
One reason why 401(k)s seem so much riskier is that their risks are just more transparent.
They include:Because 401(k)s are cheaper and less risky, more employers are able to offer retirement benefits.
And if you do have a 401(k), the same expenses and risks that existed with defined benefit plans are now on you.
Defined benefit plans invested and planned (though often poorly) around paying a regular stream of benefits to workers when they retired.
This article will discuss how Holly Energy managed to thrive, even during one of the worst downturns for the oil and gas industry in years.
"In any case, the advent of autonomous vehicles will disrupt the business model for transportation giants like Ford.
The increase pushed total debt to a fresh record of $3.75 trillion.
The lighting maker's results fell well short of what analysts were expecting.
All told, it was another disappointing quarter, but management argued that conditions would get better in its fiscal 2018.
“They might feel their membership is worth less if the club is owned by someone else.”Finally, the tax man would add to Trump’s misery.
The lighting maker's results fell well short of what analysts were expecting.
Kushner, whose fortune lies in his family's real-estate business, will also step down as the CEO of Kushner Companies.
His moves as the Observer's publisher have brought both praise and criticism.
"He bought absolutely, positively, a dying publication in the Observer," a former top employee recently told Business Insider.
Morale disintegrated as plans fizzled to award workers a promised 10% company stake.“The product was slow.
But the saving grace of funds never materialized as intended, and the misrepresentation sent employees fleeing.
She writes that investors might be wary of bank stocks, given that they’ve shot up so far so fast after the election.
But when you dig a bit further, the downside now is fairly limited.
That includes fewer acres for top consumer China and declines for major exporters, including the U. S., Canada, Australia and Kazakhstan.
A big reason for the wheat glut in recent years was mostly beneficial weather, which allowed crops to flourish and yields to improve.
The school, work and life hacks you need to get ahead.
"Tech-savvy employers in today's market are tweeting out their higher-profile and most urgent job openings.
If you're not ready to match their urgency, you could miss out.
Having a resume that yields lots of phone calls, but all for the wrong job, doesn't do you much good," Chafel says.
However, if you don't have the ability and willingness to do so, you'll quickly find yourself losing out to your competition, Chafel says.
It is the interview, good or bad, that determines whether you are selected for the job.
The market’s apparent health, however, is not balanced: Transactions actually fell slightly from 2015.
The shortage of listings pushes prices higher a little faster than they might rise otherwise.
The facts in the NAI case are clear and tell a chilling tale about the failures of U. S. trade policy.
There could be no clearer effort to undermine labor standards than the operating scheme designed by NAI’s parent company.
For the more conservative sideline sitters, the pharmaceutical industry (NYSEARCA:IHE) should offer particular appeal.
The mall owners "hope to restructure existing debts and return to operating the Fashion Square property at a profit," Shuker said.
“It’s balanced by a per-unit reduction in the cost of electricity.”Others worry it could distort incentives for energy efficiency.
"If we slip into not-so-strong earnings growth, then stocks could be vulnerable."
The broader indexes have also gained sharply since the election.
The CBOE Volatility Index (VIX), widely considered the best gauge of fear in the market, traded near 11.6.
The board provides legal, tax, and compliance professionals with critical information, practical guidance, and workflow solutions.
Cramer was willing to bet that the stock can creep towards its old level on positive commodity data and cost cuts from Trump.
The low price of crude oil limited revenue streams for exploration and production, but DNO said the market was showing signs of recovery.
If only there were some way to encourage employees to work harder without engaging in illegal behavior.
The total dating to 2011 exceeds $1 billion, according to the FDIC, which said it may revise its complaint.
Should BlackRock can its robot stock-pickers?At the very least their next performance review is going to be super-awkward.
The owner has contended that the city missed a deadline to make a $75,000 payment of earnest money, voiding the deal.
The company also bumped up full-year guidance to 94 cents in adjusted per-share net income, up from prior outlook for 92-93 cents.
Get the latest news on recent and upcoming IPOs, filings for new issues, and today’s top-performing IPO stocks.
Get 4 free weeks of the IBD Digital edition plus access to IBD's exclusive market analysis, proprietary stock ratings and interactive tools.
The "all-new" version also features adaptive LED headlights, fatigue and focus alerts and 18-inch, double-spoke wheels.
Sure, the money was still growing tax-free, but she missed out on opportunities to track and rebalance her investments.
There consumers often get sideswiped by a variety of bogus charges that can add thousands of dollars to the purchase price.
Both agencies -- as well as most other government offices -- offer an online complaint process that can be completed in minutes.
The internet makes filing a complaint with a regulator and your own elected representatives a relative breeze.
After crashing in the summer, shares of the yoga-apparel maker enjoyed a nice rebound in December.
Lululemon faces a number of issues as it tries to stay on top of the latest consumer trends.
The total dating to 2011 exceeds $1 billion, according to the FDIC, which said it may revise its complaint.
Meanwhile, food stamp use and poverty rates have eased, but still haven’t returned to their pre-recession levels.
How long the modest but steady growth will last remains in doubt.
TROX's TiO2 pigments use the higher-quality chloride technology but proprietary processes make the Company a low-cost chloride producer.
However, with $3.05 billion total debt, leverage at the Company will still be exceedingly high.
The improvement in TROX's profitability in Q2'16 and Q3'16 didn't go unnoticed by the stock market.
As shown in the graph, the Company's debt prices declined and then improved along with the common during 2016.
That building together with a run-down office building next door will be torn down to make way for upscale apartments.
The 26-year-old Ariad has a blood cancer drug on the market and is seeking US approval for a lung cancer treatment.
Takeda will not only obtain the rights to Iclusig, but it also gains Ariad’s experimental lung cancer drug, brigatinib.
"[The Ombudsman's investigation] is a victory for common sense and appropriate oversight of government policy.
By mid-year, more than $12 trillion worth of government bond yields across the world had a negative interest rate.
And that should keep the Fed in the sweet spot, with slow rate hikes.
Japan's deflation fight is the most noteworthy, following the administrations 2013 all-out assault to beat two decades of deflation.
During his years-long battle with the disorder, Parker Beam raised funds in hopes of helping find a cure.
Parker Beam had the title of master distiller emeritus at Heaven Hill at the time of this death.
Cecil-based Consol Energy [CNX] turned in the third best performance after being the worst performing regional stock in 2015.
It was a remarkable turnaround for Joy, which was the second worst performer in 2015.
The Pittsburgh company’s problems include brisk competition from internet retailers and brushes with regulators over product labeling.
But in a year when most regional stocks advanced, ExOne turned in the fifth worst performance.
While the stock ended the year well below its peak, investors cannot complain given that shares more than doubled:AG data by YCharts.
That's bound to come as a shock for some taxpayers, especially those who rely on their refund checks to pay bills and make major purchases.
As stated many times, the participation rate in the 25-54 yr old cohort is only at 81.5%, well below the pre-recession high of 83.4%.
But, he warned: "We're now in almost the third-longest recovery" in post-war history.
Brown said even a modest downturn could cost the state $18 billion in lower tax receipts.
But the unlikely star of the annual Detroit auto show is an odd-looking minivan capable of driving itself.
Utility vehicles were honored separately for the first time, with the Pacifica minivan from Fiat Chrysler snagging that award.
Is the iShares China Large-Cap (FXI) and other struggling China ETFs worth a look?
As he leaves he says his "biggest success is building a culture of customer service," something that the DRBA lacked before, he said.
BCP said it would launch the rights issue as soon as it receives regulatory approval.
Also, China’s depreciation of the yuan was orderly rather than disruptive.
A stronger dollar hurts the U. S. manufacturing sector and thus many of Trump’s voters.
The FCA chief said it would be "very stupid" for him to make predictions until Trump's intentions become clear.
The school, work and life hacks you need to get ahead.
Last month, the RTD board of directors declined to give Genova a bonus for 2016 partly because of the ongoing problems on the A-Line.
“We are confident RTD is working diligently with the contractor to fix the problems as soon as possible.”
That consensus price target was consistently stuck between $188 and $189 for the past three months.
To be fair, self-storage REITs tend to be a little more volatile than many other types, in part because of their short leases.
Theranos, formed in 2003 as a maker of cheaper, more efficient alternatives to traditional medical tests, has been troubled in recent years.
Morgan Stanley on Tuesday reiterated an overweight rating and 148 price target and called the iPhone maker a "top pick" for 2017.
It also warned on same-store sales, but comps improved during the quarter.
Still, the stock has been taking a well-deserved break after a big run-up since a March breakout.
Get the latest news on recent and upcoming IPOs, filings for new issues, and today’s top-performing IPO stocks.
Get 4 free weeks of the IBD Digital edition plus access to IBD's exclusive market analysis, proprietary stock ratings and interactive tools.
The argument is typical copsuckers/respect authority versus, you know, maybe you guys are pants-shitting pussies who overreact to dumb shit.
Constantly running his mouth about 'respect', while doling out the most gutless cheap-shot I've ever seen on Todd Heap.
They put up some scary headline #s, militarily, but they have the capability and readiness of a "lower-tier NATO state" (think, "Italy").
The war in Syria is probably at the limits of what they're capable of.
I think the US would be better off ignoring the Russians and focusing on fixing our own domestic issues.
It’s a major relief that this doesn’t get dragged into the new U. S.
Morale disintegrated as plans fizzled to award workers a promised 10% company stake.“The product was slow.
But the saving grace of funds never materialized as intended, and the misrepresentation sent employees fleeing.
Who should discipline police officers?Raw video of an attempted murder suspect leading police on a chase on the 405 Freeway Monday night.
Raw video of an attempted murder suspect leading police on a chase on the 405 Freeway Monday night.
Many, but not all, economists credit the stimulus for helping prevent a full-blown economic depression.
The economy turned around and unemployment fell in Obama’s first term, but there was still a significant problem.
Another problem for Obama has been an ongoing decline in decent jobs for people without a college education.
What is driving prices up?The short answer: there are signs the global oil glut is easing.
It is important to remember that the crude oil used to make gasoline is a global commodity.
Many possible conflicts remain across the more than 500 business interests tied to the president-elect, Trump financial filings show.
There's no denying it: Pacific Ethanol (NASDAQ:PEIX) had an amazing year in 2016.
The market handed shareholders a decisive victory and put the bears to shame.
The company could also restructure the debt.
Shares mostly fell in Asia on Tuesday, tracking losses on Wall Street apart from the Nasdaq composite index\'s fresh record high.
ENERGY: U. S. benchmark crude oil steadied, gaining 6 cents to $52.02 a barrel in electronic trading on the New York Stock Exchange.
ENERGY: U. S. benchmark crude oil steadied, gaining 6 cents to $52.02 a barrel in electronic trading on the New York Stock Exchange.
That helps explain why the bank is slashing the card’s sign-up bonus in half starting on Thursday.
"If you don't, it makes no sense to save $100 a year to only then get stuck with a $500 repair bill you can't afford.
"Drivers need to do this math to figure out if the savings are worth the increased burden of a higher deductible," Stein says.3.
The August 2015 mini flash crash triggered a severe test of channel support, which held despite a 7-point intraday violation.
More stocks rose than fell on the New York... Optimum Online customers get unlimited digital access There's more to the story!
"Aggressive cost cutting this downturn has reversed much of the 'boom town' employee-related inflation," Anderson said in the note.
The alternatives may be similar, but they’re not the same—leading the CFPB to call them misleading.
The pan-European Stoxx 600 ended 0.11 percent higher most major bourses in positive territory.
The FTSE 100 hit a new record high to extend its winning streak with help from a falling currency and a strong rally for mining firms.
"One of the things that government is rightfully criticized for is being inflexible and impractical," he added.
Get the latest news on recent and upcoming IPOs, filings for new issues, and today’s top-performing IPO stocks.
Get 4 free weeks of the IBD Digital edition plus access to IBD's exclusive market analysis, proprietary stock ratings and interactive tools.
RELATED: Wyoming profileWyoming also suffers from a small population — the smallest, in fact — which makes it less attractive for business.
They won't dry up overnight however, and we anticipate that energy bankruptcies will gradually decline over the next 12 to 18 months."
The low price of crude oil limited revenue streams for exploration and production, but DNO said the market was showing signs of recovery.
“But let’s face it, every simplified approach to deal with the global complex agenda, is condemned to fail.
The school, work and life hacks you need to get ahead.
- Adoption of “a comprehensive budget plan” which would limit the growth of the city’s budget.
Many people don't know how to get started paying off their debt efficiently.
The trick to avoiding burnout is in not denying yourself rewards – but rewarding yourself responsibly.
Iceland – 90.2%Prior to the credit crisis in 2007, government debt was a modest 27% of GDP.
At the time of WEF's rankings, its debt was still super high.
In March, Federal Reserve Chair Janet Yellen said the economy was on a path of slow and steady growth.
The school, work and life hacks you need to get ahead.
It seems to promise an awkward marriage between Hollywood memorabilia and easy-to-swallow figurative art by Norman Rockwell and others.
(The idea that the museum’s arrival will boost L. A.’s cultural reputation is — to be plain — a joke.)
But I’ve also found it hard to work up much outrage about the Lucas deal.
Would it be more faithful to the history and mission of Exposition Park to oppose the museum or welcome it?
Ever since the 2017 New Year, Bitcoin   has come into the spotlight as well as regulator's focus due to   its volatile moves.
However, skeptics say the cookie won't crumble that way.
But employers will find it difficult to find enough people with the skills to fill them.
We put our country’s long-term economic prospects at risk if we don’t invest in the skills that workers and businesses need to succeed.
One area is the healthcare profession, which is in dire need of skilled workers.
Tax prep giant H&R Block (NYSE: HRB), however, wants to remove the stigma associated with refund anticipation loans.
The claim, supported by a legal opinion prepared by the Port, was seen as dubious given that the tunnel is located miles to the north.
Lately, though, the enthusiasm has widened to include tech enthusiasts as cars get features once considered science fiction.
Quarterly outlooks from other companies failed to impress investors.
To realize this, Tanzanians must work hard to achieve the development aspirations articulated in the Tanzania Development Vision 2015.
The Institute is a UK hub for innovative bioinformatics through research, analysis and interpretation of multiple, complex data sets.
The news helped shares of hospitals, which are nervous about losing government payments for medical services.
The greenback bulls still have the firm overall technical advantage despite some choppy trading action recently.
The next downside price breakout objective for the bears is closing prices below solid support at $16.00.
The next downside price objective for the bears is closing prices below solid technical support at the December low of 244.80 cents.
And you have to be willing to work together to solve or resolve issues.
"This can be pretty intense, and there are challenging conversations," says York.
"When an employee called in sick, York worked the retail store.
"Bernardo's work demands in Chicago and abroad have become more and more intense," she wrote in the email.
The company’s colorful garments and provocative advertising quickly caught on with young fashionistas.
Who should discipline police officers?Raw video of an attempted murder suspect leading police on a chase on the 405 Freeway Monday night.
Raw video of an attempted murder suspect leading police on a chase on the 405 Freeway Monday night.
Chipotle says it's equipping all 2,200 locations with “breakthrough” technology – a device that sucks pathogens directly out of the air.
During testimony last month, many bemoaned the lack of affordable housing in the plan, which was crafted for market-rate apartments.
The formidable GOP strongholds of Georgia and Texas were said to be under threat.
"Or maybe they’ll fall in love with the trucking industry.
"If a student as a problem, we’ll all stop our menial tasks and focus on helping the student.
It says the lease was issued properly and that federal officials for decades have unfairly delayed attempts to drill.
2017 is going to be rough for offshore drillers, but there's opportunity for patient investors who can ride out the turmoil.
As I recently wrote, there's potential value in almost all of these offshore drilling stocks, but there's risk as well.
The year started with crude oil prices hitting 18-month highs on expectations that parties to the OPEC deal would make good on their word.
Volkswagen at first denied the use of the defeat device, but finally admitted to it in September of that year.
In November 2006, some employees raised objections to the defeat device to the head of VW brand engine development.
BCP said it would launch the rights issue as soon as it receives regulatory approval.
fail to secure continuing passporting rights for the British
Business owners also appear a bit split, with small-business confidence off the charts but actual spending down and hiring plans weak.
Job security and unemployment are two issues that dominate both the political and social spheres.
The only non-health related job to break the top five best jobs list was a statistician (No.
If you don’t fall into one of those categories, don’t worry, because there's still good news overall.
"The economy is strong, unemployment is continuing to drop... unless we tip into a recession."
With the breakdown of the support trendline two months back, what was support is now resistance at 545pts.
We would review our bearish outlook on the index if it can surpass its last high of 563pts.
Monthly technical indicators are negative but the index is finding support at 8-month simple moving average (SMA) line.
However, the JCI could face strong resistance at the 5,400-5,500 levels.
Internet advocacy groups saw the decision to shut down the adult ads section of the site as a blow to free speech.
A stronger greenback makes dollar-denominated crude more expensive for users of other currencies.
On Wednesday, EIA data showed crude production rose notably, particularly in the lower 48 states.
Energy was today’s best performing sector even though the EIA inventory report was hugely bearish.
The Hamblin Watsa Investment Counsel has gained expertise in investing this insurance float over the years, but even they make mistakes.
"These inflation-linked derivatives will protect Fairfax in the event of a serious global catastrophe.
It's not clear how many jobs will be lost at those plants with the end of Victory production.
Sure, the money was still growing tax-free, but she missed out on opportunities to track and rebalance her investments.
He also denied that Samsung tried to win favors through the funds.
Economists in rich countries usually stress the importance of an independent central bank.
And, even if such a policy were adopted, it is hard to believe the commitment would be credible.
Currency substitution is, without a doubt, the most credible solution.
"The news conference was a far cry from the market friendly,
The U. S. dollar, likewise, has had to surrender some of its gains
When the rubber hit the road, tough, the company blew past that target debt range.
That is in stark contrast to the 22% compounded annual growth rate investors had enjoyed up until this year.
Before Trump won the election, CEOs used to say that sending jobs overseas would boost gross margins all the time.
The school, work and life hacks you need to get ahead.
Analysts say automakers are trying to be smarter with incentives, having been burned in the past.
All of this contributed to a sharp political split in the presidential election.
Saving the relationship is more important than holding the perpetrator accountable for the crime.”Hold up.
Whether you’re 21 or 81, retirement is an important financial issue.
After two years of declines in unit revenues, Delta said it expects the key measure to turn positive this year.
Is the great California drought finally calling it quits?
Is the great California drought finally calling it quits?
